comment_enabled,content,creation_date,end_publication,excerpt,featured,id,image,last_update,login_required,password,pingback_enabled,slug,start_publication,status,tags,template,title
1,"<p dir=""ltr""><span style=""color: #000000;"">After receiving many high quality applications from determined seniors pursuing higher education, the PiE scholarship committee - consisting of PiE staff alumni - faced the tough decision of choosing an applicant to receive the $1000 scholarship.</span></p>
<p><span style=""color: #000000;"">The committee reviewed each application holistically, considering academic achievement, leadership skills, and extracurricular activities. After much deliberation, the committee selected four finalists from an incredibly strong field of candidates to receive $100 each, as well as the scholarship recipient. Vanathi Ganesh (EECS &lsquo;13), a PiE alumna and a member of the scholarship committee, announced the finalists and scholarship award winner at the award ceremony after final competition.</span></p>
<p><span style=""color: #000000;"">Meet the finalists below, as described by the Vanathi during final competition during the awards ceremony.</span></p>
<p style=""text-align: center;"" dir=""ltr""><span style=""color: #000000;""><strong>Eliot Alvarez:</strong></span></p>
<p style=""text-align: center;"" dir=""ltr""><span style=""color: #000000;"">The maturity and charism that Eliot showed impressed us. In particular we found that his advice to an eighth grader entering high school insightful. Eliot gives his advice to an eighth grader entering high school: &ldquo;Students should look ahead at what they&rsquo;ll hope to achieve in high school and beyond so that they can stay on the right path.&rdquo; Eliot is looking forward to studying Mechanical Engineering in the fall.&nbsp;</span></p>
<p style=""text-align: center;"" dir=""ltr""><span style=""color: #000000;""><strong>Zhiliang He:</strong></span></p>
<p style=""text-align: center;"" dir=""ltr""><span style=""color: #000000;"">Zhiliang demonstrated incredible effort in mastering english in a very short period of time. He demonstrates both leadership and organizational skills, both important skills that we value in PiE. He has clearly earned the respect of his teammates, and we&rsquo;re excited to welcome Zhiliang to Cal where he&rsquo;ll be studying Computer Science.</span></p>
<p style=""text-align: center;"" dir=""ltr""><span style=""color: #000000;""><strong>William Luong:</strong></span></p>
<p style=""text-align: center;"" dir=""ltr""><span style=""color: #000000;""><strong></strong>Recognized by both his mentors and teachers for planning and organizing team meetings as well for mastering CAD in a short period of time, William impressed us with his dedication and enthusiasm in the organizations that he is a part of. We&rsquo;re excited to welcome William to Cal where he&rsquo;ll be studying Physics.</span></p>
<p style=""text-align: center;"" dir=""ltr""><span style=""color: #000000;""><strong>Kate&nbsp;Reed:</strong></span></p>
<p style=""text-align: center;"" dir=""ltr""><span style=""color: #000000;"">Kate was a well-rounded candidate who demonstrated a dedication to helping others. Her love for languages has inspired her to pursue Computer Science. We expect that her academic achievements will continue in college and beyond.</span></p>
<p style=""text-align: center;""><span style=""text-decoration: underline; color: #000000;""><span style=""text-decoration: underline;""><em>Award recipient</em></span></span></p>
<p style=""text-align: center;"" dir=""ltr""><span style=""color: #000000;""><strong>Alix Plascensia:</strong></span></p>
<p style=""text-align: center;"" dir=""ltr""><span style=""color: #000000;"">An extremely impressive, self-motivated student, Alix has already achieved a great deal in her academic and professional career at her young age. The maturity and drive she demonstrates is unparalleled, and she hopes to be a great role model for her community. We look forward to seeing her at Cal this fall where she&rsquo;ll be studying architecture.</span></p>
<p style=""text-align: left;""><span><span><br /></span></span>We are deeply grateful for the financial and technical support provided by TBP and PiE alumni to explore this new avenue of supporting STEM education in the Bay Area.If you would also like to support the PiE Alumni Scholarship for next year, please consider making a donation! Any contribution is welcome. Donations can be made to Fund Number 3231 on the&nbsp;<a href=""https://givetocal.berkeley.edu/egiving/index.cfm?Fund=FN3231000"">Give to Cal website</a>. At the bottom of the form, please write ""Scholarship"" in the field titled ""Special instructions or designations for this gift.</p>
<p style=""text-align: left;""><span id=""docs-internal-guid-81b5abcf-d9e3-e1cb-f9d1-6a288596cf39""><br /><br /></span></p>",2014-05-07 20:43:24,,...,0,44,uploads/zinnia/IMG_5709.jpg,2014-05-15 00:59:39,0,,1,scholarship-2014,,2,,entry_detail.html,Recipients of the 2014 PiE Alumni Scholarship Announced
1,"<p dir=""ltr""><span>Students who have used the current control system user interface (CSUI) have probably got frustrated by the problems in it. Though </span><span>PiE has been using the control software PiEMOS in recent years, a more user-friendly control system user interface is currently being developed inside PiE. Allen Li, the project manager for CSUI, was excited to share some progress about the project he and his team members are currently working on. According to Allen, currently available user interface lacks of familiarity towards the users. In other words, the developer of existing CSUI usually expected the users to be familiar with programming. As a result, the project team has worked hard since April 2013 to design and create easy-to-use user interface for people in general, even for those who have never done robots / programming. </span></p>
<p dir=""ltr""><span>The project is aimed to make a control system particularly targeted for high school students. Even, the team is trying to design the user interface as simple as possible such that very young children can play with it at least at basic levels. </span></p>
<p dir=""ltr""><span>One of interesting aspects about the new user interface is that it provides text editor to put in whatever code the users want. Moreover, the code will wirelessly get deployed on the robot. After running the code, the user will get immediate feedback in the form of real-time graph from the robot. Hopefully, the new user interface is done immediately because I believe everyone is excited about it.</span></p>
<p><span id=""docs-internal-guid-85b0d9cf-b1dd-b7d9-bb7f-087f77a566e7""><br /><span>Here is a sneak peek of the new interface:</span></span></p>",2014-11-14 21:11:04,,,0,45,uploads/zinnia/CSUI.png,2014-11-14 21:22:23,0,,1,new-csui-inside-pie,,0,CSUI,entry_detail.html,New CSUI Inside PiE
1,"<p dir=""ltr""><span><span><span>Above is a sneak peek of the new interface where u</span></span></span>sers can send code right from an editor embedded in it.</p>
<p dir=""ltr""><span>Students who have used the current control system user interface (CSUI) have probably got frustrated by the problems in it. Though </span><span>PiE has been using the control software PiEMOS in recent years, a more user-friendly control system user interface is currently being developed inside PiE. Allen Li, the project manager for CSUI, was excited to share some progress about the project he and his team members are currently working on. According to Allen, currently available user interface lacks of familiarity towards the users. In other words, the developer of existing CSUI usually expected the users to be familiar with programming. As a result, the project team has worked hard since April 2013 to design and create easy-to-use user interface for people in general, even for those who have never done robots / programming. </span></p>
<p dir=""ltr""><span>The project is aimed to make a control system particularly targeted for high school students. Even, the team is trying to design the user interface as simple as possible such that very young children can play with it at least at basic levels. </span></p>
<p><span id=""docs-internal-guid-85b0d9cf-b503-23d6-c32f-092b059cb797""><span>One of interesting aspects about the new user interface is that it provides text editor to put in whatever code the users want. Moreover, the code will wirelessly get deployed on the robot. After running the code, the user will get immediate feedback in the form of real-time graph from the robot. Hopefully, the new user interface is done immediately because I believe everyone is excited about it.</span></span></p>",2014-11-15 11:48:23,,...,0,46,uploads/zinnia/CSUI_1.png,2014-11-15 11:55:03,0,,1,new-csui-inside-pie,,2,"CSUI, ",entry_detail.html,New CSUI Inside PiE
1,"<p dir=""ltr""><span>In the figure above, Prep DeCal students and facilitators worked together to figure out a code to solve the maze challenge. </span></p>
<p>Prep has been an active and successful part of PiE for three years now. Recently, Manda Au, the Program Director of Prep, was excited to share some information about what has been going on in Prep so far.</p>
<p>For those who are unfamiliar, Prep has been taught as Berkeley DeCal class for two years. Like last year, the goal of this year's Prep is both giving hands on experience and teaching advanced programming as well as keeping students engaged inside the classroom. The main difference between this year&rsquo;s and last year&rsquo;s Prep is that mentors are encouraged more to be the main teachers at the high schools this year.</p>
<p>For this semester, the Decal take place once a week on Tuesdays. There are 9 mentors which are divided into 2 teams. One team is assigned to go to Community Day in Oakland, which is an expulsion school. The activity led by the mentors is part of after school program there switching between Wednesday and Friday. There are 2-3 students at Community Day participating in the program. Another team is sent out to Ralph Bunche Oakland in Oakland which is a continuation school. The mentors in the team teach science to the students there during physics class on every Thursday. There are about 6-10 participants from the school.</p>
<p>At the beginning, the activities at those schools were aimed to interest the students in science. Then, after several weeks, the activities were steered toward robotics and maze lesson. One of robotic projects assigned to the students were tug of war robot. This project mainly involved mechanical skills. The students were given about 2 weeks to work on the project. Then, they had to compete to find out which robot was the strongest. Not only was Lego mindstorms used for tug-of-war challenge, but it was also used to build robot that can go through a maze for the sake of maze lesson. This project involved both programming and mechanical skills. They had about a month to figure out to program the robot such that it could be successfully driven in the maze.</p>
<p dir=""ltr""><span>The Prep Decal is still going on right now and will end in the last week of instruction. However, PiE will keep sending mentors to the schools until next semester. Related to Prep, there will be Prep Field Trip on December 9 when the high school students will come to Cal and PiE will give them a tour. Hopefully, everything Prep team has done for the high school students can be useful for their school and their future.</span></p>
<div><span><br /></span></div>",2014-12-05 22:16:12,,...,0,47,uploads/zinnia/Prep3.jpg,2014-12-09 17:07:30,0,,1,prep-amazing-way-give-back,,2,"prep, ",entry_detail.html,"Prep, An Amazing Way to Give Back"
1,"<p dir=""ltr""><span>Around 20 Prep students from Community Day toured the UC Berkeley campus this Tuesday for the annual Prep field trip that occurs at end for the program. The goal of the field trip was to give students a first-hand experience to be on a college campus and experience the day-to-day life of a college student.&nbsp;</span></p>
<p>PiE debuted the Hovercraft project as the last activity of the day, a project that several of PiE&rsquo;s newest staff members have been working together on in preparation for the students&rsquo; visit. The goal of hovercraft was to introduce both high school students and new staff members that you can create something fun with just a few physics concepts and everyday materials.</p>
<p>One of these members is Katrina Jiang; she joined PiE this semester and shares her experience working on the hovercraft: &ldquo;The hovercraft project introduced me to not only basic woodworking tools and skills, but also the environment that teaches collaboration and cohesion within a team. I felt that, although I am still a novice at mechanical engineering related projects, my ideas were appreciated, taken into consideration, and sometimes implemented and that I made direct and productive contributions to the success of the hovercraft.&rdquo;&nbsp;</p>
<p dir=""ltr""><span>The hovercraft works by creating a cushion of air underneath a circular piece of wood. &nbsp;The wood provides a space to sit on while the pressure from the air curtain on the wood balances out the weight of the person. The person on the craft can experience a gliding sensation as he or she is pushed across a smooth surface.</span></p>",2014-12-12 02:01:29,,...,0,48,uploads/zinnia/20141209_103812.jpg,2014-12-12 02:08:05,0,,1,hovercraft-project-debuts-prep-fieldtrip,,2,"hovercraft, prep,  fieldtrip, project",entry_detail.html,Hovercraft Project Debuts at Prep Fieldtrip
1,"<p style=""text-align: center;"" dir=""ltr""><span>Future mentors learned to come up with strategies to win a game.</span></p>
<p>Robotics competition, the biggest event in the PiE calendar, has been getting closer and closer. It is only weeks before the competition. To better prepare the participants for the competition, PiE created RC DeCal Spring 2015. Two weeks ago, Justin Jorge, who is the project manager for RC DeCal Spring 2015, enthusiastically shared some details about RC DeCal this year.</p>
<p dir=""ltr"">The RC DeCal team, which consists of five PiE staff, is responsible for training Cal students to be mentors for the high school students participating in PiE&rsquo;s robotic competition in April 2015. With Justin&rsquo;s background as a former participant in the robotics competition as well as a staff member of RC DeCal last year, he&rsquo;s full of excellent ideas! Working together with his team, they came up with some plans for the DeCal.</p>
<p dir=""ltr"">According to the plan, the DeCal team will teach the soon-to-be mentors - who will be working with the students - about game analysis, mechanical, and autonomous programming. In addition to lectures, two main ways the team prepares the mentors are through engaging activities and hands-on experience. Justin also emphasized that the skills needed to be a good mentor and work well with students are not just technical skills. Mentors need to be able to work in a team, communicate well with high school students, and have a tremendous amount of patience. The mentors are also trained to push students to find the answers to their own problems instead of giving away the answers to the students. Furthermore, the DeCal team guides the future mentors to improve their confidence and leadership skills such that they can assist high school students even after their time in PiE.</p>
<p dir=""ltr"">Kevin Durand, a returning mentor for RC DeCal Spring 2015, shared some positive comments about his experiences with RC DeCal. He said that his interest in mentoring made him always want to come back to RC DeCal. He found it enjoyable as well as rewarding to mentor high school students with their brilliant and creative ideas. Moreover, becoming a mentor in RC DeCal &nbsp;allowed him to learn about many new, interesting things and eventually helped him decide his current major. Based on his comments, it can be seen how great the impact of RC DeCal is; the mentors and high school students can simultaneously improve each other in many ways.</p>
<p>To appeal to as many Cal students as possible from a variety of majors, the PiE team actively spread the word about the DeCal. We&rsquo;ve worked really hard to promote RC DeCal through social media, DeCal expo, Calapalooza, chalking, and flyers. This year, the DeCal gathered up to 78 mentors in the first week, one of the highest turnout rates we&rsquo;ve had!</p>
<p dir=""ltr"">The first meeting was great because the class was fully occupied. In the meeting, the soon-to-be mentors broke into groups to learn about game analysis. In the game CanHaz CheezBurger, the mentors had to pick a robot to play with and try to earn as high score as possible. While aiming for a high score, they had to take into account the penalties and come up with some key strategies. At the end of the activity, the groups had to compete against each other to find out which group had the best strategy. This activity would prepare the mentors in terms of critical thinking skills and brainstorming needed when they work with the high school students in the actual competition.</p>
<p dir=""ltr"">Four weeks after learning the basics and going through relevant activities, the mentors will be assigned to 24 different teams participating in the competition. If the number of mentors can be maintained throughout, there will be about 2 to 3 mentors per team. They will be paired based on their expertise such that they can complement each other while assisting the students.</p>
<p><span id=""docs-internal-guid-c7dbf8c8-c3a7-54e2-0f41-46f0011f5211""><span>Though RC DeCal has been going great so far, support and help, particularly from PiE staff, will be much appreciated. So, let&rsquo;s contribute to the success of RC DeCal together. Finally, for the RC DeCal team, keep up the good work and good luck!</span></span></p>",2015-02-25 18:11:23,,...,0,49,uploads/zinnia/DeCal.jpg,2015-02-25 18:22:54,0,,1,rc-decal-preparing-final-competition,,2,DeCal final competition robotics mentors,entry_detail.html,RC DeCal: Preparing For Final Competition!
1,"<p style=""text-align: center;"" dir=""ltr""><span>PiE 2014 final scholarship recipient Alix receiving her award after final competition </span></p>
<p>After the successful debut of the PiE Alumni Scholarship last year, PiE alumni have been working to plan another scholarship this year! Thanks to the generosity of PiE alumni, this scholarship has been increased from $1000 to $1500 this year.</p>
<p>Alix Plascensia, who is PiE scholarship&rsquo;s previous winner and a current freshman at UC Berkeley, states that the PiE Alumni Scholarship has helped a lot in terms of her education. Because of the scholarship, she could take some time off from her job and pursue her education by joining Summer Bridge, a six-week college program that offers newly admitted freshmen to jump start their academic career. She wrote to PiE Alumni Scholarship committee about how she is enjoying her study, and we are glad to know it. Her positive feedback shows how a little help can have a huge impact in student&rsquo;s life.</p>
<p>This year, we hope that all eligible students take advantage of this opportunity. High school students who are in their last year of education, have participated in a PiE season, and plan to pursue higher level of education are eligible and highly encouraged to apply for this scholarship. The applicants will be holistically assessed, but we are generally looking for applicants who have some STEM experiences. The application will be released on <strong>February 28, 2015</strong> during Kickoff. On the same day at <strong>2pm</strong>, there will be a scholarship workshop at <span style=""text-decoration: line-through;""><strong>120B Becthel</strong></span>&nbsp;<strong>380 Soda</strong> where students can get their questions answered and guidance to fill out the scholarship application.</p>
<p>For the application to be considered, applicants should submit their <strong>scholarship application and a copy of their unofficial transcript</strong> by <strong>April 11, 2015</strong>. Though recommendation is optional, applicants are highly recommended to submit a 2-page recommendation form since the recommendation will definitely strengthen the application.The scholarship recipient will be announced around late April and early May. We highly encourage that PiE students take advantage of and spread the word about this opportunity!For more detailed information, check out <a href=""/programs/scholarship/"">PiE scholarship webpage</a>. Or you can email any questions to scholarship@pioneers.berkeley.edu. &nbsp;</p>
<p>If you would also like to support the PiE Alumni Scholarship, please consider making a donation! Any contribution is welcome. Donations can be made to Fund Number 3231 on the <a href=""https://givetocal.berkeley.edu/egiving/index.cfm?Fund=FN3231000"">Give to Cal website</a>. At the bottom of the form, please write ""Scholarship"" in the field titled ""Special instructions or designations for this gift.""</p>
<p>EDIT (2/28/15 @ 12:15AM: Workshop location has been changed to <strong>380 Soda</strong>.</p>",2015-02-27 13:35:23,,...,0,50,uploads/zinnia/IMG_5691.jpg,2015-02-28 00:16:09,0,,1,high-school-seniors-pie-alumni-scholarship-announced-second-year,,2,alumni scholarship kickoff application workshop,entry_detail.html,High School Seniors: PiE Alumni Scholarship Announced For the Second Year! 
1,"<p dir=""ltr"">You might have noticed that PiE has been livestreaming each of our season events this year! That&rsquo;s correct, we are revamping our production value!</p>
<p>More concretely, we are interested in letting visitors of Youtube Channel and our Twitch.tv stream see how exciting our program is in addition to our live visitors and local community. (they are&nbsp;<a href=""https://www.youtube.com/pierobotics"">https://www.youtube.com/pierobotics</a>, and&nbsp;<a href=""http://www.twitch.tv/pierobotics"">http://www.twitch.tv/pierobotics</a>)</p>
<p><br />Here is our UC Berkeley campus headquarters livestream setup:</p>
<p dir=""ltr""><img src=""https://lh5.googleusercontent.com/Sh5K2URlQNoOE1jK-NxoRkRpj04UbOP99bviaWcWs0CDNxD0hCSoIAk1oYmrH7udwDZDq9L6XrWWx3SKwVNlaEbRGCVlN3mk-3rE0bIBtktPL91v--ovnf05PZpz34IV"" alt="""" width=""624px;"" height=""468px;"" /></p>
<p>The notable change from last year is our use of new camera technology. Previously we used the&nbsp;<a href=""http://www.microsoft.com/hardware/en-us/p/lifecam-studio"">Microsoft Lifecam Studio</a>, but had to use&nbsp;<a href=""http://www.monoprice.com/Product?c_id=103&amp;cp_id=10303&amp;cs_id=1030312&amp;p_id=8751&amp;seq=1&amp;format=2"">Monoprice&rsquo;s 16ft. active USB extenders</a>&nbsp;to achieve the cable length required for the desired shots. Additionally, the computer needed 4 USB Root Hubs in order to stream 1080p video from 4 cameras simultaneously, which was prone to failure and caused video glitches.</p>
<div>&nbsp;<img src=""https://lh4.googleusercontent.com/wxPYwFUxUqbVgxPhkUHDvgNTWGrwTvBhdv5C7Cm-T3YEi_PV9j77Pg_igE-hG7IxlL2BpDXXLj4_dHNaiNOu7jPlqxHAyXB_Zret5HJIuzd97VeOOiRcscji4QJmrGeb"" alt="""" width=""624px;"" height=""468px;"" /></div>
<p>We are now using&nbsp;<a href=""http://www.123-cctv.com/"">123 CCTV Security Camera</a>&nbsp;and&nbsp;<a href=""http://www.cctvcameraworld.com/"">CCTV Camera World</a>&rsquo;s generous joint donation of the&nbsp;<a href=""http://www.cctvcameraworld.com/2-megapixel-outdoor-ip-camera-bullet-1080p.html"">2 Megapixel Bullet IP Camera</a>. These are designed to stream 1080p h.264 encoded video over Ethernet, which does not require breaking any cable length specification (as was the case with our USB rigging). These are traditionally used for security purposes, but 123 CCTV Security Camera and CCTV Camera World have helped us access the RTSP video stream directly for use in our video streaming pipeline.<img src=""https://lh6.googleusercontent.com/1hwxnXMKlqB-2UafSMCBm-aClWHrfmp02KPLaoWPdRzY_9w8YG89eB3nzrT-Hrc55SxrIiNFIgP22BpXoKvN3UJU-MPnhwMmrfOphCHbEe5Kvci7jgDHx9oNr6yA5Ib5"" alt="""" width=""624px;"" height=""468px;"" /></p>
<p dir=""ltr"">On the software front, we are taking a step in uploading matches with audio. Because we play non-royalty-free music at our events, we can&rsquo;t upload the raw video stream to youtube without copyright infringement on the music. To this end, we are recording the microphone audio exclusively using Audacity, and using the resultant audio with our uploaded videos.</p>
<p dir=""ltr""><strong>Get excited!</strong></p>",2015-03-17 12:43:35,,...,0,51,,2015-03-17 12:45:43,0,,1,new-livestreaming-systems,,2,"2015, events, twitch, youtube, livestream",entry_detail.html,New Livestreaming Systems!
