comment_enabled,content,creation_date,end_publication,excerpt,featured,id,image,last_update,login_required,password,pingback_enabled,slug,start_publication,status,tags,template,title
1,"<p dir=""ltr""><span>On Friday October 25 the tables were reversed, and Prep students came to the UC Berkeley campus.</span></p>
<p dir=""ltr""><span>As a part of the college preparation unit, Prep students were brought to the UC Berkeley campus to get a taste of college life. &nbsp;The students spent the day touring the campus with the mentors, getting to see some of the school&rsquo;s highlights: the T-Rex in VLSB, Upper Sproul plaza, Doe Library, among others. &nbsp;For many, it was their first trip up the Campanile. &nbsp;As a part of the tour, students got a taste of life on the engineering side of campus. &nbsp;They got to see the engineering work areas, such as the Hackerspace in Cory or the Civil Engineering work area in Davis; students also got to see some of the projects undergraduate engineers work on, such as the concrete canoe.</span></p>
<p dir=""ltr"">In addition to the campus tour, the students had a guest lecture by <a href=""https://sites.google.com/site/prometheusuntenured/"">Terry Johnson</a>, from the Bioengineering Department at UC Berkeley. &nbsp;Johnson&rsquo;s talk highlighted what it meant to be someone in science or in engineering. &nbsp;He challenged the long-standing image of scientists and engineers as math geniuses with access to high-tech labs, stating that all it takes is curiosity and the drive to find solutions to problems. &nbsp;</p>
<p><span id=""docs-internal-guid--d0d2899-0270-9428-0a41-f800caf37dac""><span>And with this Prep students continue into the rest of the Prep season, an uncharted domain for their curiosity. &nbsp;</span></span></p>",2013-10-28 21:19:53,,,0,34,uploads/zinnia/field_trip_test.jpg,2013-10-28 21:21:07,0,,1,prep-field-trip,,2,,entry_detail.html,Prep Comes to Cal
1,"<p dir=""ltr""><span>This week has been Computer Science Education Week (</span><a href=""http://csedweek.org/""><span>CSEdWeek</span></a><span>), an annual program dedicated to inspiring K-12 students to take interest in computer science. One program that CSEdWeek offers is a one-hour introduction to CS known as Hour of Code. Today, PiE visited </span><a href=""http://www.joaquinmiller.org/""><span>Joaquin Miller Elementary School</span></a><span> to work with students on Hour of Code.</span></p>
<p dir=""ltr""><span>We worked with a class of 3rd graders on the the basic concepts of Computer Science. They advanced through a game-like tutorial on CS concepts like loops, conditionals, pattern recognition, and basic algorithms (</span><a href=""http://learn.code.org/""><span>link here</span></a><span>). Despite the tricky subject matter, the students found the lesson fun and engaging! In the tutorial the students helped a Zombie, from Plants vs. Zombies, reach a sunflower through different mazes. As the whole lesson progressed, the students had fun and learned a lot of new computer science concepts.</span></p>
<p dir=""ltr""><span>Hour of Code is an exciting and engaging way for students of all ages to learn about programming and computational thinking. We highly encourage students to look into all of the resources available at code.org and try to code for an hour this week.</span></p>
<p dir=""ltr""><span>This Friday, PiE Prep will be doing an Hour of Code of their own with Ralphe Bunche students, many of which will program for the first time. Look forward to another blog post about that.</span></p>
<p dir=""ltr""><span>Thanks once again to Ms. Smith, Ms. Moore, and Joaquin Miller Elementary School for having us today!</span></p>
<p dir=""ltr""><span><img src=""https://tbp.berkeley.edu/gallery/d/363119-2/IMG_0398.JPG"" alt="""" width=""300"" height=""195"" /></span></p>
<div><span><br /></span></div>",2013-12-11 23:36:20,,...,0,35,uploads/zinnia/IMG_0440.JPG,2013-12-12 03:09:08,0,,1,hour-code,,2,Hour of Code CS programming ,entry_detail.html,Hour of Code
1,"<p><span id=""docs-internal-guid-1d47f39f-fa5f-04e0-7f57-22ad18fab02c"">After <a href=""/blog/2013/12/11/hour-code/"">volunteering at Joaquin Miller Elementary School</a> this past Wednesday, PiE had a day full of Hour of Code in honor of CS Education Week.</span></p>
<p dir=""ltr""><span>Early in the morning on Friday, PiE members visited Oakland Technical High School to participate in their CS ED Week assembly. &nbsp;As a part of the assembly, there were representatives from the Oakland School District, Level Playing Field, UC Berkeley, Computer Science Teachers&rsquo; Assosiation, as well as Ali Partovi, co-founder of code.org and one of the primary organizers of the Hour of Code. &nbsp;Partovi made a brief presentation, during which he spoke about his experiences with CS, starting from seventh grade, and about the importance of computer science in society, as well as CS Education Week. &nbsp;</span></p>
<p dir=""ltr""><span>Following the assembly at Oakland Technical High School, PiE hosted an Hour of Code at Ralph Bunche High School and Alameda Community Learning Center, as a part of the PiE Prep program. &nbsp;Students spent an entire hour doing an online tutorial, which varied from the Blockly Angry Birds tutorial to any of the Javascript tutorials.</span></p>
<p dir=""ltr"">PiE was glad to be a part of CS Education Week and to have hosted an Hour of Code. &nbsp;For those of you interested in doing a tutorial at home, check out <a href=""http://code.org/learn"">code.org</a>.</p>
<div><span><br /></span></div>
<div><span><img src=""https://lh5.googleusercontent.com/-tTpPLka2YBw/UqvKmBv_U8I/AAAAAAAAGp4/bdFojkj78OQ/w818-h545-no/IMG_0482.JPG"" alt=""Hour of Code--Ralph Bunche High School"" width=""300"" height=""180"" /></span></div>
<p><span><br /></span></p>",2013-12-15 23:47:01,,,0,36,uploads/zinnia/maybe_hour.JPG,2013-12-16 00:00:35,0,,1,pie-does-hour-code,,2,,entry_detail.html,PiE Does Hour of Code
1,"<p dir=""ltr""><span>Last Friday, March 3, 2014, the PiE Prep Season came to a successful close. &nbsp;In the 2013-2014 season, PiE Prep staff and mentors carried out 16 project based STEM lessons and activities with students at Ralph Bunche High School in Oakland and at Alameda Community Learning Center (ACLC) in Alameda. &nbsp;</span></p>
<p>Over the course of these lessons, students explored electricity and magnetism, <a href=""/blog/2013/10/19/one-two-three-pull/"">mechanical design</a>, principles of computational thinking via <a href=""https://code.google.com/p/blockly/"">Blockly</a>, and programming sensors via the <a href=""https://education.lego.com/en-us/lego-education-product-database/mindstorms/9797-lego-mindstorms-education-base-set"">Lego Mindstorms kits</a>. &nbsp;In these past four weeks, students at Ralph Bunche were working with the Blockly programming lessons. &nbsp;Meanwhile, students at ACLC worked on a final robot project designed by PiE staff. &nbsp;As a part of the project, students had to use Lego Mindstorms to assemble a robot that could correctly sort colored blocks, drive up an incline, and traverse a maze.</p>
<p><span id=""docs-internal-guid-53eef4b2-915a-eb84-1b55-c2dbf8999999""><span>Prep&rsquo;s aim is to expose students to science and engineering principles. With this initial exposure, we hope that students would be interested and motivated to then independently further pursue STEM-related topics and projects. Prep&rsquo;s secondary goal is to get students introduced to the skills they would be using during the Spring Robotic&rsquo;s Competition. Thus, as the Prep Season ended, the Robotics competition began with the season Kickoff, March 1, 2014. Be on the lookout for Robotics Season blog posts and check out our 2014 album on Facebook!</span></span></p>",2014-03-05 00:26:42,,...,0,37,uploads/zinnia/IMG_20140228_142850.jpg,2014-03-07 22:00:27,0,,1,prep-end-beginning-robotics-competition,,2,,entry_detail.html,Prep End Marks the Beginning of the Robotics Competition Season
1,"<p dir=""ltr""><span>PiE has grown in various ways over the last six years. We have expanded our season by a week, doubled the length of our Final Competition, nearly tripled our staff roster, and extended our reach into San Francisco. Another important sign of our growth is the increasing number of PiE alumni now in academia and industry.</span></p>
<p dir=""ltr""><span>Last October, Vanathi Ganesh (Class of &lsquo;13 EECS), a former PiE DeCal instructor, conceived the idea of reaching out to Tau Beta Pi and PiE staff alumni to create an annual scholarship for PiE students moving on to post-secondary education. The idea has come to fruition: this spring, one $1000 scholarship will be awarded. The application went live this past Saturday at Game Day and will be due on April 14, the Monday after Scrimmage.</span></p>
<p dir=""ltr""><span>We&rsquo;re very excited to offer this opportunity for the first time! Of course, it wouldn&rsquo;t have been possible without the philanthropic support of our TBP and PiE alumni. We are deeply grateful for the financial and technical support that they have provided to PiE in order to explore a new avenue of supporting STEM education in the Bay Area.</span></p>
<p dir=""ltr""><span>If you would also like to support the PiE Alumni Scholarship, please consider making a donation! Any contribution is welcome. Donations can be made to Fund Number 3231 on the&nbsp;</span><a href=""https://givetocal.berkeley.edu/egiving/index.cfm?Fund=FN3231000""><span>Give to Cal website</span></a><span>. At the bottom of the form, please write ""Scholarship"" in the field titled ""Special instructions or designations for this gift.""</span></p>",2014-03-10 23:26:27,,...,0,38,uploads/zinnia/DSC01578.jpg,2014-03-11 00:43:46,0,,1,pioneers-engineering-proud-announce-its-inaugural-pie-alumni-scholarship,,2,,entry_detail.html,Pioneers in Engineering is proud to announce its inaugural PiE Alumni Scholarship!
1,"<p dir=""ltr""><span>PiE Robotics Competition Kickoff is always an exciting event, and this year was no exception. &nbsp;Teams met their mentors, received their Robotics Kits, and many were able to finish the day having achieved their goal of constructing a driving base robot!</span></p>
<p dir=""ltr""><span>However, just three weeks before, the 2014 Robotics Competition was in danger of cancellation.</span></p>
<p dir=""ltr"">It was then when we learned that the <a href=""https://www.ghielectronics.com/catalog/product/256"">Fez Panda II</a>, an irreplaceable component of our Robotics Kit, was being retired by all suppliers. &nbsp;Sparkfun Electronics, a longtime supporter of PiE without whom our competition could not have happened this year, was unable to supply all the Panda II&rsquo;s we require.</p>
<p dir=""ltr""><span>This revelation set off a quite a stir among us, who immediately took the &lsquo;Pandamonium&rsquo; in hand and started searching for solutions. &nbsp;We quickly discovered that the surest way to save the competition was to manufacture our own pandas - no mean feat, considering that we had 3 weeks to do what should take 3 months.</span></p>
<p dir=""ltr"">The manufacture of pandas would not have been possible without the support of one company in particular, <a href=""https://www.ghielectronics.com"">GHI Electronics</a>. &nbsp;PIE&rsquo;s use of the Panda II requires a specific firmware to be loaded onto a key component of the Pandas. &nbsp;GHI, the sole supplier of this software, graciously offered to load this firmware onto the chips at reduced cost, even though PiE needed a comparatively small quantity, and even though both the chips and the software are outdated.</p>
<p dir=""ltr""><span>We are incredibly grateful to GHI and in particular Gary Beaver, their Director of Operations, for their fast response and generosity.</span></p>
<p>Without their help, Pandas would have gone extinct, and there wouldn&rsquo;t have been a Robotics Competition this year<strong id=""docs-internal-guid-cf74acd8-dbd9-89ff-5a9e-c4f1c13ba2ec""><span>.</span></strong></p>",2014-03-19 12:37:09,,,0,39,uploads/zinnia/12899851045_28d9804b10_o.jpg,2014-03-19 12:42:51,0,,1,why-2014-robotics-competition-almost-didnt-happen,2014-03-19 12:42:41,2,,entry_detail.html,Why the 2014 Robotics Competition Almost Didnt Happen
1,"<p dir=""ltr""><span>We have extended the deadline for the </span><a href=""/programs/scholarship/""><span>inaugural PiE Alumni Scholarship</span></a><span> to </span><span>5p PST on Friday, April 18. </span><span>&nbsp;</span></p>
<p dir=""ltr""><span>We have made the </span><span>transcript and teacher recommendation optional, but recommended,</span><span> in light of time concerns. If you have already turned in a transcript or a teacher recommendation, we will take them into consideration during the review process. We anticipate that this will strengthen your application.</span></p>
<p dir=""ltr""><span>It&rsquo;s not too late to start the application! We strongly encourage every senior to apply since we are drawing from a limited pool of applicants. All those that apply have very good odds of receiving the scholarship.</span></p>
<p dir=""ltr""><span>Please let us know if you encounter difficulties of any kind by emailing </span><span>scholarship@pioneers.berkeley.edu.&nbsp;</span>We hope to see your application!</p>
<div><span><br /></span></div>",2014-04-14 14:26:10,,,0,40,,2014-04-14 14:27:40,0,,1,pie-2014-scholarship-extended,,0,,entry_detail.html,PiE 2014 Scholarship Extended!
1,"<p dir=""ltr""><span>We have extended the deadline for the </span><a href=""/programs/scholarship/""><span>inaugural PiE Alumni Scholarship</span></a><span> to </span><span>5p PST on Friday, April 18. </span><span>&nbsp;</span></p>
<p dir=""ltr""><span>We have made the </span><span>transcript and teacher recommendation optional, but recommended,</span><span> in light of time concerns. If you have already turned in a transcript or a teacher recommendation, we will take them into consideration during the review process. We anticipate that this will strengthen your application.</span></p>
<p dir=""ltr""><span>It&rsquo;s not too late to start the application! We strongly encourage every senior to apply since we are drawing from a limited pool of applicants. All those that apply have very good odds of receiving the scholarship.</span></p>
<p dir=""ltr""><span>Please let us know if you encounter difficulties of any kind by emailing </span><span>scholarship@pioneers.berkeley.edu.&nbsp;</span>We hope to see your application!</p>
<div><span><br /></span></div>",2014-04-14 14:27:42,,...,0,41,,2014-04-14 14:28:05,0,,1,scholarship-extended,,2,,entry_detail.html,PiE 2014 Scholarship Extended!
1,"<p>Awards are given yearly at the end of Final Competition to recognize team accomplishments. ""Judging this year is the hardest I've ever seen it,"" Brian Harvey tells the crowd anticipating the Judges' Awards this year. This says a lot, as he's been a judge for PiE for four years. ""It is a&nbsp;<em>pleasant</em>&nbsp;thing that it's is so hard to choose recipients,"" he says, implying that this is an indication of the outstanding designs this year.&nbsp;</p>
<p>In fact, judging was so difficult that the judges found it necessary to do shout-outs to schools they felt exhibited excellence in each category, since there could only be one winner chosen. The list of recipients for the awards are listed below.&nbsp;</p>
<h2 style=""text-align: center;"">PiE Competition Judges' Awards<span style=""font-size: 1.5em;"">&nbsp;</span></h2>
<h3 style=""text-align: center;"">Engineering Professionalism: Berkeley High&nbsp;</h3>
<h3 style=""text-align: center;"">Mechanical Design: Nea&nbsp;</h3>
<h3 style=""text-align: center;"">Software, Sensors, and Control: De Anza</h3>
<h3 style=""text-align: center;"">Agilent Spirit Award: Alameda Community Learning Center</h3>
<h3 style=""text-align: center;"">Judges' Award: Albany &nbsp;</h3>
<p style=""text-align: center;"">&nbsp;</p>",2014-04-27 16:18:45,,...,0,42,uploads/zinnia/DSC_1335.jpg,2014-04-28 01:47:42,0,,1,winners-2014-judges-awards,,2,"2014, competition winners",entry_detail.html,Winners of the 2014 Judges' Awards
1,"<p dir=""ltr"">After receiving many high quality applications from determined seniors pursuing higher education, the PiE scholarship committee - consisting of PiE staff alumni - faced the tough decision of choosing an applicant to receive the $1000 scholarship.</p>
<p>The committee reviewed each application holistically, considering academic achievement, leadership skills, and extracurricular activities. After much deliberation, the committee selected four finalists from an incredibly strong field of candidates to receive $100 each, as well as the scholarship recipient. Vanathi Ganesh (EECS &lsquo;13), a PiE alumna and a member of the scholarship committee, announced the finalists and scholarship award winner at the award ceremony after final competition.</p>
<p>Meet the finalists below, as described by the Vanathi during final competition during the awards ceremony.</p>
<p style=""text-align: center;"" dir=""ltr""><span><strong>Eliot Alvarez:</strong> </span></p>
<p style=""text-align: center;"" dir=""ltr""><span>The maturity and charism that Eliot showed impressed us. In particular we found that his advice to an eighth grader entering high school insightful. Eliot gives his advice to an eighth grader entering high school: &ldquo;Students should look ahead at what they&rsquo;ll hope to achieve in high school and beyond so that they can stay on the right path.&rdquo; Eliot is looking forward to studying Mechanical Engineering in the fall. </span></p>
<p style=""text-align: center;""><span><span><br /></span></span></p>
<p style=""text-align: center;"" dir=""ltr""><strong>Zhiliang He:</strong></p>
<p style=""text-align: center;"" dir=""ltr""><span>Zhiliang demonstrated incredible effort in mastering english in a very short period of time. He demonstrates both leadership and organizational skills, both important skills that we value in PiE. He has clearly earned the respect of his teammates, and we&rsquo;re excited to welcome Zhiliang to Cal where he&rsquo;ll be studying Computer Science. </span></p>
<p style=""text-align: center;""><span><span><br /></span></span></p>
<p style=""text-align: center;"" dir=""ltr""><strong>William Luong:</strong></p>
<p style=""text-align: center;"" dir=""ltr""><span>Recognized by both his mentors and teachers for planning and organizing team meetings as well for mastering CAD in a short period of time, William impressed us with his dedication and enthusiasm in the organizations that he is a part of. We&rsquo;re excited to welcome William to Cal where he&rsquo;ll be studying Physics. </span></p>
<p style=""text-align: center;""><span><span><br /></span></span></p>
<p style=""text-align: center;"" dir=""ltr""><strong>Kate&nbsp;Reed:</strong></p>
<p style=""text-align: center;"" dir=""ltr""><span>Kate was a well-rounded candidate who demonstrated a dedication to helping others. Her love for languages has inspired her to pursue Computer Science. We expect that her academic achievements will continue in college and beyond. </span></p>
<p style=""text-align: center;""><span><span><br /></span></span></p>
<p style=""text-align: center;"" dir=""ltr""><em>Award recipient</em></p>
<p style=""text-align: center;"" dir=""ltr""><strong>Alix Plascensia:</strong></p>
<p style=""text-align: center;"" dir=""ltr""><span>An extremely impressive, self-motivated student, Alix has already achieved a great deal in her academic and professional career at her young age. The maturity and drive she demonstrates is unparalleled, and she hopes to be a great role model for her community. We look forward to seeing her at Cal this fall where she&rsquo;ll be studying architecture. </span></p>
<p style=""text-align: left;""><span><span><br /><br /><br /></span></span></p>
<p style=""text-align: left;"" dir=""ltr""><span>We are deeply grateful for the financial and technical support provided by TBP and PiE alumni to explore this new avenue of supporting STEM education in the Bay Area.</span></p>
<p style=""text-align: left;"" dir=""ltr""><span>If you would also like to support the PiE Alumni Scholarship for next year, please consider making a donation! Any contribution is welcome. Donations can be made to Fund Number 3231 on the&nbsp;</span><a href=""https://givetocal.berkeley.edu/egiving/index.cfm?Fund=FN3231000""><span>Give to Cal website</span></a><span>. At the bottom of the form, please write ""Scholarship"" in the field titled ""Special instructions or designations for this gift.</span></p>
<p style=""text-align: left;""><span id=""docs-internal-guid-81b5abcf-d9e3-e1cb-f9d1-6a288596cf39""><br /><br /></span></p>",2014-05-07 20:33:32,,,0,43,uploads/zinnia/IMG_5696.jpg,2014-05-07 20:54:41,0,,1,recipients-2014-pie-alumni-scholarship-announced,,0,,entry_detail.html,Recipients of the 2014 PiE Alumni Scholarship Announced
